{
  "$schema": "https://json-schema.org/draft/2020-12/schema",
  "type": "object",
  "properties": {
    "equipmentId": {
      "type": "string",
      "minLength": 1
    },
    "from": {
      "type": "string",
      "pattern": "^\\d{4}-\\d{2}-\\d{2}T\\d{2}:\\d{2}:\\d{2}\\.\\d{3}$"
    },
    "to": {
      "type": "string",
      "pattern": "^\\d{4}-\\d{2}-\\d{2}T\\d{2}:\\d{2}:\\d{2}\\.\\d{3}$"
    },
    "timeDomain": {
      "type": "string"
    },
    "watermark": {
      "type": "object",
      "properties": {
        "seq": {
          "type": "integer",
          "minimum": 0,
          "maximum": 9007199254740991
        },
        "at": {
          "type": "string",
          "pattern": "^\\d{4}-\\d{2}-\\d{2}T\\d{2}:\\d{2}:\\d{2}\\.\\d{3}$"
        }
      },
      "required": [
        "seq",
        "at"
      ],
      "additionalProperties": false
    },
    "parserContractVersion": {
      "type": "string"
    },
    "dataGeneration": {
      "type": "string"
    },
    "occurrences": {
      "type": "array",
      "items": {
        "type": "object",
        "properties": {
          "id": {
            "type": "string",
            "minLength": 1
          },
          "equipmentId": {
            "type": "string",
            "minLength": 1
          },
          "kind": {
            "type": "string",
            "enum": [
              "VISIT",
              "TRANSFER",
              "PROCESS",
              "POST_PROCESS",
              "FUNCTION",
              "CARRIER_PRESENCE"
            ]
          },
          "start": {
            "type": "object",
            "properties": {
              "at": {
                "anyOf": [
                  {
                    "type": "string",
                    "pattern": "^\\d{4}-\\d{2}-\\d{2}T\\d{2}:\\d{2}:\\d{2}\\.\\d{3}$"
                  },
                  {
                    "type": "null"
                  }
                ]
              },
              "seq": {
                "type": "integer",
                "minimum": 0,
                "maximum": 9007199254740991
              },
              "evidence": {
                "type": "string",
                "enum": [
                  "observed",
                  "derived",
                  "illustrative",
                  "unknown"
                ]
              },
              "reason": {
                "type": "string"
              }
            },
            "required": [
              "at",
              "seq",
              "evidence"
            ],
            "additionalProperties": false
          },
          "end": {
            "anyOf": [
              {
                "type": "object",
                "properties": {
                  "at": {
                    "anyOf": [
                      {
                        "type": "string",
                        "pattern": "^\\d{4}-\\d{2}-\\d{2}T\\d{2}:\\d{2}:\\d{2}\\.\\d{3}$"
                      },
                      {
                        "type": "null"
                      }
                    ]
                  },
                  "seq": {
                    "type": "integer",
                    "minimum": 0,
                    "maximum": 9007199254740991
                  },
                  "evidence": {
                    "type": "string",
                    "enum": [
                      "observed",
                      "derived",
                      "illustrative",
                      "unknown"
                    ]
                  },
                  "reason": {
                    "type": "string"
                  }
                },
                "required": [
                  "at",
                  "seq",
                  "evidence"
                ],
                "additionalProperties": false
              },
              {
                "type": "null"
              }
            ]
          },
          "location": {
            "type": "object",
            "properties": {
              "moduleAlias": {
                "type": "string",
                "minLength": 1
              },
              "slotAlias": {
                "type": "string",
                "minLength": 1
              }
            },
            "required": [
              "moduleAlias"
            ],
            "additionalProperties": false
          },
          "from": {
            "type": "object",
            "properties": {
              "moduleAlias": {
                "type": "string",
                "minLength": 1
              },
              "slotAlias": {
                "type": "string",
                "minLength": 1
              }
            },
            "required": [
              "moduleAlias"
            ],
            "additionalProperties": false
          },
          "to": {
            "type": "object",
            "properties": {
              "moduleAlias": {
                "type": "string",
                "minLength": 1
              },
              "slotAlias": {
                "type": "string",
                "minLength": 1
              }
            },
            "required": [
              "moduleAlias"
            ],
            "additionalProperties": false
          },
          "material": {
            "type": "object",
            "properties": {
              "kind": {
                "type": "string",
                "enum": [
                  "wafer",
                  "carrier",
                  "batch",
                  "boat",
                  "reticle"
                ]
              },
              "id": {
                "anyOf": [
                  {
                    "type": "string",
                    "minLength": 1
                  },
                  {
                    "type": "null"
                  }
                ]
              },
              "identityEvidence": {
                "type": "string",
                "enum": [
                  "observed",
                  "derived",
                  "illustrative",
                  "unknown"
                ]
              },
              "lotId": {
                "type": "string",
                "minLength": 1
              },
              "jobId": {
                "type": "string",
                "minLength": 1
              }
            },
            "required": [
              "kind",
              "id",
              "identityEvidence"
            ],
            "additionalProperties": false
          },
          "synthetic": {
            "type": "boolean"
          },
          "source": {
            "type": "object",
            "properties": {
              "parserContractVersion": {
                "type": "string"
              },
              "dataGeneration": {
                "type": "string"
              },
              "recordRef": {
                "type": "string"
              }
            },
            "required": [
              "parserContractVersion",
              "dataGeneration"
            ],
            "additionalProperties": false
          }
        },
        "required": [
          "id",
          "equipmentId",
          "kind",
          "start",
          "end",
          "synthetic",
          "source"
        ],
        "additionalProperties": false
      }
    },
    "issues": {
      "type": "array",
      "items": {
        "type": "object",
        "properties": {
          "id": {
            "type": "string",
            "minLength": 1
          },
          "equipmentId": {
            "type": "string",
            "minLength": 1
          },
          "issueType": {
            "type": "string"
          },
          "seq": {
            "type": "integer",
            "minimum": 0,
            "maximum": 9007199254740991
          },
          "at": {
            "anyOf": [
              {
                "type": "string",
                "pattern": "^\\d{4}-\\d{2}-\\d{2}T\\d{2}:\\d{2}:\\d{2}\\.\\d{3}$"
              },
              {
                "type": "null"
              }
            ]
          },
          "relatedOccurrenceId": {
            "type": "string",
            "minLength": 1
          }
        },
        "required": [
          "id",
          "equipmentId",
          "issueType",
          "seq",
          "at"
        ],
        "additionalProperties": false
      }
    },
    "continuationToken": {
      "type": "string"
    }
  },
  "required": [
    "equipmentId",
    "from",
    "to",
    "timeDomain",
    "watermark",
    "parserContractVersion",
    "dataGeneration",
    "occurrences",
    "issues"
  ],
  "additionalProperties": false
}
